uuid	created_at	created_longitude	created_latitude	modified_at	modified_longitude	modified_latitude	accessed_at	content	tags	folder	flagged	languageGrammar
15926C5D-3CE0-4359-87B7-65BF267FC7C1	2025-05-21T01:56:06Z	0.0	0.0	2025-05-21T01:56:08Z	0.0	0.0	2025-05-21T01:56:06Z	"Item Name	Armor Type	Description/Function	SP (Stopping Power)	Encumbrance/Weight (kg)	Coverage	Special Features	Penalties	Cost (eb)	Availability	Source	Special Notes
Heavy Leather Jacket	Jacket	Basic reinforced leather; urban fashion armor	SP 4	[TBD]	Arms, Torso	None	None	[TBD]	Common	Corebook p.240, V3.0 p.241	Edged weapons: half SP [oai_citation:0‡Cyberpunk-V3-0-Core-Rules-v3-0.pdf](file-service://file-MWhvhvik9H9QZhVvrFEBRj)
Fibremesh Ballistic Shirt	Shirt/Soft Armor	Flexible soft ballistic fabric	SP 8	[TBD]	Arms, Torso	None	None	[TBD]	Common	Corebook p.240, V3.0 p.241	Edged weapons: half SP
Fibremesh Pants	Pants/Soft Armor	Flexible soft ballistic fabric	SP 8	[TBD]	Legs	None	None	[TBD]	Common	Corebook p.240, V3.0 p.241	Edged weapons: half SP
Kevlar Vest	Vest	Lightweight body armor vest	SP 10	EV +0	Torso	None	None	[TBD]	Common	Corebook p.240, V3.0 p.241	Edged weapons: half SP
Kevlar Light Jacket	Jacket	Light armor jacket, often worn by civvies	SP 14	EV +0	Torso, Arms	None	None	[TBD]	Common	Corebook p.240, V3.0 p.241	Edged weapons: half SP
Kevlar Medium Jacket	Jacket	Medium armor jacket	SP 18	EV +1	Torso, Arms	None	-1 REF	[TBD]	Common	Corebook p.240, V3.0 p.241	Edged weapons: half SP
Steel Helmet	Helmet	Basic steel helmet	SP 14	EV +0	Head	None	None	[TBD]	Common	Corebook p.240, V3.0 p.241	
Nylon Helmet	Helmet	Composite helmet, military/police	SP 20	EV +0	Head	Low-light, anti-dazzle, radio	None	[TBD]	Common	Home of the Brave p.??, Corebook p.240, V3.0 p.241	Can be upgraded with Targeting for 200eb [oai_citation:1‡Cyberpunk-2020-CP3221-Home-of-the-Brave-pdf.pdf](file-service://file-BD6TS1rKBLdN59Pf5Nd5m6)
Flak Vest	Vest	Flak protection for torso, soft armor	SP 20	EV +1	Torso	None	-1 REF	[TBD]	Common	Corebook p.240, V3.0 p.241	
Flak Pants	Pants	Padded flak protection for legs	SP 20	EV +1	Legs	None	-1 REF	[TBD]	Common	Corebook p.240, V3.0 p.241	
Door Gunner’s Vest	Vest	Hardened ballistic vest for vehicle use	SP 25	EV +3	Torso	None	-3 REF	[TBD]	Rare	Corebook p.240, V3.0 p.241	
MetalGear Body Armor	Full Suit	Hardened composite, heavy suit	SP 25	EV +2	Full Body	None	-2 REF	[TBD]	Rare	Corebook p.240, V3.0 p.241	
Patrol Armor	Suit (Flexi-Armor)	Flexi-armor suit with optional alloy plates	Legs: SP18/23, Torso: SP20, Arms: SP15/20	EV +2/+3	Legs, Torso, Arms	Optional plates: +5 SP to limbs	None	900	Common	Protect & Serve p.??	Optional plates increase EV to +3 [oai_citation:2‡Cyberpunk-2020-CP3171-Protect-Serve.pdf](file-service://file-Ni9obP9A6HexSHN9XJVjbY) [oai_citation:3‡Cyberpunk-2020-CP3171-Protect-Serve.pdf](file-service://file-Ni9obP9A6HexSHN9XJVjbY)
Max Threat Urban Riot Armor	Suit (Riot)	Riot control armor, heavy	Arms/Torso: SP25, Legs: SP20 (+8 alloy plates)	EV +3	Full Body	Alloy plates: +8 SP to limbs	-3 REF	1200	Rare	Protect & Serve p.??	Full riot gear for close combat [oai_citation:4‡Cyberpunk-2020-CP3171-Protect-Serve.pdf](file-service://file-Ni9obP9A6HexSHN9XJVjbY) [oai_citation:5‡Cyberpunk-2020-CP3171-Protect-Serve.pdf](file-service://file-Ni9obP9A6HexSHN9XJVjbY)
Police Issue Patrol Helmet	Helmet	Patrol helmet with comms, beamlight, anti-dazzle	SP 25	[TBD]	Head	Targeting/Infrared option, two-way radio, anti-dazzle	None	230 (430 w/option)	Common	Protect & Serve p.??	Works with Patrol Armor [oai_citation:6‡Cyberpunk-2020-CP3171-Protect-Serve.pdf](file-service://file-Ni9obP9A6HexSHN9XJVjbY)
Police Issue Riot Helmet	Helmet	Riot helmet, sealed with air supply	SP 25	[TBD]	Head	Enviro-sealed, 10-min air, anti-dazzle	None	650	Common	Protect & Serve p.??	Infrared, targeting scope, compatible with Patrol Armor [oai_citation:7‡Cyberpunk-2020-CP3171-Protect-Serve.pdf](file-service://file-Ni9obP9A6HexSHN9XJVjbY)
Police Issue Traffic Helmet	Helmet	Light helmet with digital stillcam	SP 15	[TBD]	Head	Digital camera, lighter weight	None	170	Common	Protect & Serve p.??	No infrared/targeting capabilities [oai_citation:8‡Cyberpunk-2020-CP3171-Protect-Serve.pdf](file-service://file-Ni9obP9A6HexSHN9XJVjbY)
Police Issue Paramedic Helmet	Helmet	Paramedic helmet with anti-dazzle, comms	SP 20	[TBD]	Head	Anti-dazzle, two-way radio	None	180	Common	Protect & Serve p.??	For paramedic drivers [oai_citation:9‡Cyberpunk-2020-CP3171-Protect-Serve.pdf](file-service://file-Ni9obP9A6HexSHN9XJVjbY)
Police Issue Riot Shield	Riot Shield	Full-length plastic riot shield, Militech Taser option	SP 15	[TBD]	Full Body	Strobelight (option), built-in taser, battery-powered	None	150 (180 w/option)	Common	Protect & Serve p.??	Strobe: REF/BOD saves or stun, battery for 10 pulses [oai_citation:10‡Cyberpunk-2020-CP3171-Protect-Serve.pdf](file-service://file-Ni9obP9A6HexSHN9XJVjbY) [oai_citation:11‡Cyberpunk-2020-CP3171-Protect-Serve.pdf](file-service://file-Ni9obP9A6HexSHN9XJVjbY)
Police Issue General Purpose Shield	Shield	Smaller, round patrol shield	SP 10	[TBD]	Arms/Torso	None	None	80	Common	Protect & Serve p.??	Standard beat patrol shield [oai_citation:12‡Cyberpunk-2020-CP3171-Protect-Serve.pdf](file-service://file-Ni9obP9A6HexSHN9XJVjbY)
Militech M-88 Revised Combat Helmet	Helmet	Enclosed infantry helmet; IR/low-light, HUD, respirator	Helmet: SP 20, Faceplate: SP 15	1.25 (helmet + belt pack)	Head	IR/low-light/anti-dazzle, HUD, targeting, comms, battery-powered	-1 REF	5000 (10,000 black market)	Rare/Restricted	Corpbook II p.60-61	Faceplate 15 SP; 10 SDP to electronics; cyber interface; 7-day battery [oai_citation:13‡Cyberpunk-2020-Corpbook-II-Lazarus-and-Militech.pdf](file-service://file-QF1utnvWumobJid2JYtvDz) [oai_citation:14‡Cyberpunk-2020-Corpbook-II-Lazarus-and-Militech.pdf](file-service://file-QF1utnvWumobJid2JYtvDz)
Standard Field Armor (Military)	Suit (Military)	Kevlar jumpsuit, optional armor inserts	SP 14 (base), SP 20 (with inserts)	EV +0 (base), +1 (with inserts)	Full Body	Heat vents, NBC option, cooling unit	-1 REF with inserts	1500 (cooler 100)	Common (military)	Home of the Brave p.??, Corebook p.240	Inserts halve SP vs. knives/edged weapons unless inserted; NBC capable, air-sealable [oai_citation:15‡Cyberpunk-2020-CP3221-Home-of-the-Brave-pdf.pdf](file-service://file-BD6TS1rKBLdN59Pf5Nd5m6) [oai_citation:16‡Cyberpunk-2020-CP3221-Home-of-the-Brave-pdf.pdf](file-service://file-BD6TS1rKBLdN59Pf5Nd5m6)
Assault Armor (Military)	Suit (Assault)	Heavy composite armor for direct fire combat	SP 28	EV +2	Full Body	NBC protection, 2-hr cooling, IR signature diffuser, radar stealth	-2 REF	3000 (military); 6000+ (black market)	Rare	Home of the Brave p.??	Thermo/radar stealth; upgrade to air tanks +2 EV, +500eb [oai_citation:17‡Cyberpunk-2020-CP3221-Home-of-the-Brave-pdf.pdf](file-service://file-BD6TS1rKBLdN59Pf5Nd5m6)
Naval Armor (Military)	Suit (Naval)	Bulkier, flotation capable; anti-cut protection	SP 16	EV +3	Full Body	Floats, anti-cut, full SP vs. knives/sharp weapons	-3 REF	[TBD]	Rare	Home of the Brave p.??	No special features vs. bullets/bombs; heavy; water ops only [oai_citation:18‡Cyberpunk-2020-CP3221-Home-of-the-Brave-pdf.pdf](file-service://file-BD6TS1rKBLdN59Pf5Nd5m6)
Power Armor (Various)	Powered Armor	See Maximum Metal/field-specific tables	Varies (SP 25–80+)	Varies (heavy)	Full Body/Chassis	All PA features, integral power, sensors, etc.	Varies	Varies	Illegal/Restricted	Maximum Metal p.??, Home of the Brave p.??	See powered armor section for full stats [oai_citation:19‡Cyberpunk-2020-CP3221-Home-of-the-Brave-pdf.pdf](file-service://file-BD6TS1rKBLdN59Pf5Nd5m6) [oai_citation:20‡Maximum-Metal.pdf](file-service://file-8bdystwC8vHhAeCbwe7h7C)"		0	false	Markdown
