Source	Encounter_Name/Type	Region/Setting	Trigger/Context	Effect/Outcome	Local_Faction/NPC	Vs_Stat/Check	DV	Special_Notes
Alternate-Reality-Media-Junkie-2-Final-Cut.pdf p.17-18, 20, 31-34, 35-39, 40-43 [oai_citation:0‡Alternate-Reality-Media-Junkie-2-Final-Cut.pdf](file-service://file-SrCJTkHhewci71TnMrrhDH) [oai_citation:1‡Alternate-Reality-Media-Junkie-2-Final-Cut.pdf](file-service://file-D8a9DGV1Uf26vPiv9G7gva) [oai_citation:2‡Alternate-Reality-Media-Junkie-2-Final-Cut.pdf](file-service://file-D8a9DGV1Uf26vPiv9G7gva) [oai_citation:3‡Alternate-Reality-Media-Junkie-2-Final-Cut.pdf](file-service://file-SrCJTkHhewci71TnMrrhDH)	Nomad Pack Camp	Badlands, Rockies, Nomad Route	Tracking nomad caravan; party searching for lost item, rumor, or escort	Entry negotiation (ID check, weapons check), forced travel with pack, risk of violence if trust broken; possible were-creature ambush	Local Nomad Pack, Sentries, Pack Leader	Awareness (find camp, spot sentries), Persuasion (gain entry), Stealth (avoid notice)	Difficult (spot sentries), Easy (track pack), Persuasion as needed	Travel required by tradition; trust issues can escalate to deadly violence; possible supernatural elements (were-panther, hunter)
Cyberpunk-2020-CP3221-Home-of-the-Brave-pdf.pdf p.36-37 [oai_citation:4‡Cyberpunk-2020-CP3221-Home-of-the-Brave-pdf.pdf](file-service://file-BD6TS1rKBLdN59Pf5Nd5m6) [oai_citation:5‡Cyberpunk-2020-CP3221-Home-of-the-Brave-pdf.pdf](file-service://file-396ufjwAWXneaSQcDwdVom)	Gang Harassment of Migrant Group	Urban (South Central LA, 1990s)	Nomad group traveling through hostile urban turf	Violence, calls for government aid, possible escalation to public spectacle	Gangs, Nomad Family (Aldecaldo)	COOL (defuse tension), INT (spot threat)	[TBD]	Early event in nomad history, sparks national controversy, may trigger further urban violence
Cyberpunk-2020-CP3221-Home-of-the-Brave-pdf.pdf p.36-37 [oai_citation:6‡Cyberpunk-2020-CP3221-Home-of-the-Brave-pdf.pdf](file-service://file-BD6TS1rKBLdN59Pf5Nd5m6) [oai_citation:7‡Cyberpunk-2020-CP3221-Home-of-the-Brave-pdf.pdf](file-service://file-396ufjwAWXneaSQcDwdVom)	Emergency Relocation Camp Riot	Government Training Camp (Urban/Outlands)	"Government attempts forced relocation for aid (""Cor-N-Kibble""); overcrowding, deprivation, disease"	Riot, mass starvation, outbreaks (AIDS 2, Typhoid Beta), guards attacked, high casualties	Camp guards, displaced persons, government agents	COOL (riot control), Awareness (disease signs), BODY (survive deprivation)	[TBD]	Millions die before camps revolt or collapse; government overwhelmed
Cyberpunk-2020-CP3221-Home-of-the-Brave-pdf.pdf p.36-37 [oai_citation:8‡Cyberpunk-2020-CP3221-Home-of-the-Brave-pdf.pdf](file-service://file-BD6TS1rKBLdN59Pf5Nd5m6) [oai_citation:9‡Cyberpunk-2020-CP3221-Home-of-the-Brave-pdf.pdf](file-service://file-396ufjwAWXneaSQcDwdVom)	Earthquake Mass Grave Event	Urban (Los Angeles)	Major quake strikes, infrastructure overwhelmed	Mass burials required, labor contracts to nomads, escalates local family rivalry	Local Nomad Families (Jodes, Aldecaldo), Military	INT (contract negotiation), Awareness (hazards)	[TBD]	Nomad contract leads to interfamily skirmishes, sets stage for mobile nomad economy
Alternate-Reality-Media-Junkie-2-Final-Cut.pdf p.17, 20, 30-34 [oai_citation:10‡Alternate-Reality-Media-Junkie-2-Final-Cut.pdf](file-service://file-D8a9DGV1Uf26vPiv9G7gva) [oai_citation:11‡Alternate-Reality-Media-Junkie-2-Final-Cut.pdf](file-service://file-SrCJTkHhewci71TnMrrhDH)	Barroom Gambler Hook	Urban, Bar	Seeking out gambler for info; must bribe barkeep, navigate local suspicion	Possible betrayal, gambling debts, escalation to chase/violence	"Barkeep, Jonathan ""Ace"" Ellis, local toughs"	Persuasion (barkeep), COOL (read crowd)	[TBD]	Gambler always over his head, info may be unreliable; can trigger further hooks
Alternate-Reality-Media-Junkie-2-Final-Cut.pdf p.29-34 [oai_citation:12‡Alternate-Reality-Media-Junkie-2-Final-Cut.pdf](file-service://file-D8a9DGV1Uf26vPiv9G7gva) [oai_citation:13‡Alternate-Reality-Media-Junkie-2-Final-Cut.pdf](file-service://file-6NMFUSC62QRn35HMuQPtcu)	Carnival Grounds Showdown	Rural/Outskirts, Carnival	Gathering at carnival site; multiple parties converge for confrontation/negotiation	Multiple encounters possible: duel, betrayal, law enforcement arrival, sudden violence	Local Fixers, Carnival staff, The Marquis, Tommy Lee	COOL (keep peace), REF (combat), INT (spot trap)	[TBD]	Multi-threaded outcome—may gain loot, lose key NPCs, spark local rumor
Alternate-Reality-Media-Junkie-2-Final-Cut.pdf p.35-39 [oai_citation:14‡Alternate-Reality-Media-Junkie-2-Final-Cut.pdf](file-service://file-D8a9DGV1Uf26vPiv9G7gva) [oai_citation:15‡Alternate-Reality-Media-Junkie-2-Final-Cut.pdf](file-service://file-6NMFUSC62QRn35HMuQPtcu)	Sewers: Monster Hunt	Urban Underground, Sewers	Party follows trail of rumors or missing persons into undercity/sewers	Combat with mutated threats or escaped experiments, risk of disease or contamination	Mutants, escaped test subjects, local outcasts	BODY (resist disease), Awareness (ambush), REF (combat)	[TBD]	Potential for rare loot, connections with underworld; exposure can have lasting effects
[TBD]（Neo-Tribes, not included in snippet—request for full table if needed）	Highway Traveler Stop	Badlands, Nomad Route	Travelers flagged down for help, trade, or scam	Possible ambush, genuine plea for aid, barter event, or setup for ongoing relationship	Local Nomads, Bandits, Travelers	AWARENESS (spot deception), COOL (negotiation)	[TBD]	Event may be repeatable; risk/reward varies by approach
